Title,Description,Length,Guests,Cabins,Crew,Year,Builder,Main_Image_URL,Image_URL_1,Image_URL_2,Image_URL_3,Image_URL_4,SKU,Base_Price,Old_Price,Quantity,Charter_Duration,Package_Type,Category,Card_Mark,Engine,Max_Speed,Cruising_Speed,Beam,Draft,Water_Toys,Additional_Info,External_ID
"Azure Princess","Luxurious motor yacht offering unparalleled comfort and elegance.",64,10,3,4,2018,"Sunseeker",https://example.com/yacht1-main.jpg,https://example.com/yacht1-1.jpg,https://example.com/yacht1-2.jpg,https://example.com/yacht1-3.jpg,https://example.com/yacht1-4.jpg,AP-W-BASIC,25000,28000,1,"Week","Basic","Motor Yachts","",2x MAN 1200HP,28,22,5.4,1.8,"Jet ski, SeaBob, Paddleboard, Snorkeling gear","Includes basic crew service and fuel for 4 hours daily",YT001
"Azure Princess",,,,,,,,,,,,,AP-W-PREMIUM,28000,32000,1,"Week","Premium","Motor Yachts",,,,,,,,"Includes full crew service, all fuel, and daily chef service",
"Azure Princess",,,,,,,,,,,,,AP-D-BASIC,4500,5000,1,"Day","Basic","Motor Yachts",,,,,,,,"Includes basic crew service and fuel for 4 hours",
"Blue Horizon","Sleek and modern yacht with spacious entertaining areas.",72,12,4,5,2020,"Ferretti",https://example.com/yacht2-main.jpg,https://example.com/yacht2-1.jpg,https://example.com/yacht2-2.jpg,https://example.com/yacht2-3.jpg,https://example.com/yacht2-4.jpg,BH-W-BASIC,30000,33000,1,"Week","Basic","Motor Yachts","NEW",2x MTU 1600HP,32,25,6.2,2.1,"Jet ski x2, SeaBob x2, Water slide, Paddleboard x4, Kayak x2","Includes basic crew service and fuel for 4 hours daily",YT002
"Blue Horizon",,,,,,,,,,,,,BH-W-PREMIUM,35000,38000,1,"Week","Premium","Motor Yachts",,,,,,,,"Includes full crew service, all fuel, and daily chef service",
"Blue Horizon",,,,,,,,,,,,,BH-D-BASIC,5500,6000,1,"Day","Basic","Motor Yachts",,,,,,,,"Includes basic crew service and fuel for 4 hours", 